{"schemaId":"God2NativeSemanticWireVerification","schemaVersion":1,"inputPath":"dll-native-semantic-event-v2.jsonl","inputSHA256":"D91F95D5A2F6F3BB553B68303F06F7E017CF6BE71AA04B534AED497E6D74D023","eventTypeDigest":"A354EB5BB9E7632C8712DA37E6DADDFEC1ED8ED0984C38E2FCBB32C100C6958C","inputLineCount":25,"allEventTypesUnique":true,"passed":true,"totals":{"readerAcceptedCount":25,"sourceTokenBoundCount":25,"fixturePayloadBoundCount":25,"authorityFailClosedCount":25,"dispatchCount":25,"roundTripCount":25,"corruptionRejectedCount":25,"versionRejectedCount":25,"promotionPolicyCount":25},"rows":[{"wireLine":1,"definitionIndex":0,"eventType":"PacketBoundary","readerAccepted":true,"sourceTokenBound":true,"fixturePayloadBound":true,"authorityFailClosed":true,"dispatchPassed":true,"roundTripPassed":true,"corruptionRejected":true,"versionRejected":true,"promotionPolicyPassed":true,"dispatchSink":"ProtocolRecovery","promotionPolicy":"StandardEvidenceGates"},{"wireLine":2,"definitionIndex":1,"eventType":"ParserRead","readerAccepted":true,"sourceTokenBound":true,"fixturePayloadBound":true,"authorityFailClosed":true,"dispatchPassed":true,"roundTripPassed":true,"corruptionRejected":true,"versionRejected":true,"promotionPolicyPassed":true,"dispatchSink":"ProtocolRecovery","promotionPolicy":"StandardEvidenceGates"},{"wireLine":3,"definitionIndex":2,"eventType":"SerializerWrite","readerAccepted":true,"sourceTokenBound":true,"fixturePayloadBound":true,"authorityFailClosed":true,"dispatchPassed":true,"roundTripPassed":true,"corruptionRejected":true,"versionRejected":true,"promotionPolicyPassed":true,"dispatchSink":"ProtocolRecovery","promotionPolicy":"StandardEvidenceGates"},{"wireLine":4,"definitionIndex":3,"eventType":"HandlerInvocation","readerAccepted":true,"sourceTokenBound":true,"fixturePayloadBound":true,"authorityFailClosed":true,"dispatchPassed":true,"roundTripPassed":true,"corruptionRejected":true,"versionRejected":true,"promotionPolicyPassed":true,"dispatchSink":"ProtocolRecovery","promotionPolicy":"StandardEvidenceGates"},{"wireLine":5,"definitionIndex":4,"eventType":"HandlerArgument","readerAccepted":true,"sourceTokenBound":true,"fixturePayloadBound":true,"authorityFailClosed":true,"dispatchPassed":true,"roundTripPassed":true,"corruptionRejected":true,"versionRejected":true,"promotionPolicyPassed":true,"dispatchSink":"ProtocolRecovery","promotionPolicy":"StandardEvidenceGates"},{"wireLine":6,"definitionIndex":5,"eventType":"ObjectAllocated","readerAccepted":true,"sourceTokenBound":true,"fixturePayloadBound":true,"authorityFailClosed":true,"dispatchPassed":true,"roundTripPassed":true,"corruptionRejected":true,"versionRejected":true,"promotionPolicyPassed":true,"dispatchSink":"ObjectRecovery","promotionPolicy":"StandardEvidenceGates"},{"wireLine":7,"definitionIndex":6,"eventType":"ObjectDestroyed","readerAccepted":true,"sourceTokenBound":true,"fixturePayloadBound":true,"authorityFailClosed":true,"dispatchPassed":true,"roundTripPassed":true,"corruptionRejected":true,"versionRejected":true,"promotionPolicyPassed":true,"dispatchSink":"ObjectRecovery","promotionPolicy":"StandardEvidenceGates"},{"wireLine":8,"definitionIndex":7,"eventType":"ObjectResolved","readerAccepted":true,"sourceTokenBound":true,"fixturePayloadBound":true,"authorityFailClosed":true,"dispatchPassed":true,"roundTripPassed":true,"corruptionRejected":true,"versionRejected":true,"promotionPolicyPassed":true,"dispatchSink":"ObjectRecovery","promotionPolicy":"StandardEvidenceGates"},{"wireLine":9,"definitionIndex":8,"eventType":"ObjectLookup","readerAccepted":true,"sourceTokenBound":true,"fixturePayloadBound":true,"authorityFailClosed":true,"dispatchPassed":true,"roundTripPassed":true,"corruptionRejected":true,"versionRejected":true,"promotionPolicyPassed":true,"dispatchSink":"ObjectRecovery","promotionPolicy":"StandardEvidenceGates"},{"wireLine":10,"definitionIndex":9,"eventType":"RegistryLocated","readerAccepted":true,"sourceTokenBound":true,"fixturePayloadBound":true,"authorityFailClosed":true,"dispatchPassed":true,"roundTripPassed":true,"corruptionRejected":true,"versionRejected":true,"promotionPolicyPassed":true,"dispatchSink":"RegistryRecovery","promotionPolicy":"StandardEvidenceGates"},{"wireLine":11,"definitionIndex":10,"eventType":"RegistryEnumerated","readerAccepted":true,"sourceTokenBound":true,"fixturePayloadBound":true,"authorityFailClosed":true,"dispatchPassed":true,"roundTripPassed":true,"corruptionRejected":true,"versionRejected":true,"promotionPolicyPassed":true,"dispatchSink":"RegistryRecovery","promotionPolicy":"StandardEvidenceGates"},{"wireLine":12,"definitionIndex":11,"eventType":"ResourceRead","readerAccepted":true,"sourceTokenBound":true,"fixturePayloadBound":true,"authorityFailClosed":true,"dispatchPassed":true,"roundTripPassed":true,"corruptionRejected":true,"versionRejected":true,"promotionPolicyPassed":true,"dispatchSink":"ResourceRecovery","promotionPolicy":"StandardEvidenceGates"},{"wireLine":13,"definitionIndex":12,"eventType":"ResourceDecoded","readerAccepted":true,"sourceTokenBound":true,"fixturePayloadBound":true,"authorityFailClosed":true,"dispatchPassed":true,"roundTripPassed":true,"corruptionRejected":true,"versionRejected":true,"promotionPolicyPassed":true,"dispatchSink":"ResourceRecovery","promotionPolicy":"StandardEvidenceGates"},{"wireLine":14,"definitionIndex":13,"eventType":"ResourceDeserialized","readerAccepted":true,"sourceTokenBound":true,"fixturePayloadBound":true,"authorityFailClosed":true,"dispatchPassed":true,"roundTripPassed":true,"corruptionRejected":true,"versionRejected":true,"promotionPolicyPassed":true,"dispatchSink":"ResourceRecovery","promotionPolicy":"StandardEvidenceGates"},{"wireLine":15,"definitionIndex":14,"eventType":"StateMutation","readerAccepted":true,"sourceTokenBound":true,"fixturePayloadBound":true,"authorityFailClosed":true,"dispatchPassed":true,"roundTripPassed":true,"corruptionRejected":true,"versionRejected":true,"promotionPolicyPassed":true,"dispatchSink":"MutationRecovery","promotionPolicy":"StandardEvidenceGates"},{"wireLine":16,"definitionIndex":15,"eventType":"TaintSeed","readerAccepted":true,"sourceTokenBound":true,"fixturePayloadBound":true,"authorityFailClosed":true,"dispatchPassed":true,"roundTripPassed":true,"corruptionRejected":true,"versionRejected":true,"promotionPolicyPassed":true,"dispatchSink":"ValueProvenanceRecovery","promotionPolicy":"StandardEvidenceGates"},{"wireLine":17,"definitionIndex":16,"eventType":"TaintPropagation","readerAccepted":true,"sourceTokenBound":true,"fixturePayloadBound":true,"authorityFailClosed":true,"dispatchPassed":true,"roundTripPassed":true,"corruptionRejected":true,"versionRejected":true,"promotionPolicyPassed":true,"dispatchSink":"ValueProvenanceRecovery","promotionPolicy":"StandardEvidenceGates"},{"wireLine":18,"definitionIndex":17,"eventType":"ValueFlow","readerAccepted":true,"sourceTokenBound":true,"fixturePayloadBound":true,"authorityFailClosed":true,"dispatchPassed":true,"roundTripPassed":true,"corruptionRejected":true,"versionRejected":true,"promotionPolicyPassed":true,"dispatchSink":"ValueProvenanceRecovery","promotionPolicy":"StandardEvidenceGates"},{"wireLine":19,"definitionIndex":18,"eventType":"FormulaOperand","readerAccepted":true,"sourceTokenBound":true,"fixturePayloadBound":true,"authorityFailClosed":true,"dispatchPassed":true,"roundTripPassed":true,"corruptionRejected":true,"versionRejected":true,"promotionPolicyPassed":true,"dispatchSink":"FormulaRecovery","promotionPolicy":"StandardEvidenceGates"},{"wireLine":20,"definitionIndex":19,"eventType":"FormulaResult","readerAccepted":true,"sourceTokenBound":true,"fixturePayloadBound":true,"authorityFailClosed":true,"dispatchPassed":true,"roundTripPassed":true,"corruptionRejected":true,"versionRejected":true,"promotionPolicyPassed":true,"dispatchSink":"FormulaRecovery","promotionPolicy":"StandardEvidenceGates"},{"wireLine":21,"definitionIndex":20,"eventType":"FunctionRoleCandidate","readerAccepted":true,"sourceTokenBound":true,"fixturePayloadBound":true,"authorityFailClosed":true,"dispatchPassed":true,"roundTripPassed":true,"corruptionRejected":true,"versionRejected":true,"promotionPolicyPassed":true,"dispatchSink":"CandidateLedger","promotionPolicy":"NoPromotion"},{"wireLine":22,"definitionIndex":21,"eventType":"UIAnchor","readerAccepted":true,"sourceTokenBound":true,"fixturePayloadBound":true,"authorityFailClosed":true,"dispatchPassed":true,"roundTripPassed":true,"corruptionRejected":true,"versionRejected":true,"promotionPolicyPassed":true,"dispatchSink":"ContentRecovery","promotionPolicy":"StandardEvidenceGates"},{"wireLine":23,"definitionIndex":22,"eventType":"SnapshotObject","readerAccepted":true,"sourceTokenBound":true,"fixturePayloadBound":true,"authorityFailClosed":true,"dispatchPassed":true,"roundTripPassed":true,"corruptionRejected":true,"versionRejected":true,"promotionPolicyPassed":true,"dispatchSink":"SnapshotRecovery","promotionPolicy":"StandardEvidenceGates"},{"wireLine":24,"definitionIndex":23,"eventType":"SnapshotEdge","readerAccepted":true,"sourceTokenBound":true,"fixturePayloadBound":true,"authorityFailClosed":true,"dispatchPassed":true,"roundTripPassed":true,"corruptionRejected":true,"versionRejected":true,"promotionPolicyPassed":true,"dispatchSink":"SnapshotRecovery","promotionPolicy":"StandardEvidenceGates"},{"wireLine":25,"definitionIndex":24,"eventType":"ProbeDiagnostic","readerAccepted":true,"sourceTokenBound":true,"fixturePayloadBound":true,"authorityFailClosed":true,"dispatchPassed":true,"roundTripPassed":true,"corruptionRejected":true,"versionRejected":true,"promotionPolicyPassed":true,"dispatchSink":"DiagnosticLedger","promotionPolicy":"NoPromotion"}],"error":""}
